{
  "schema_version": 1,
  "message_id": "0192f4c5-3c4d-7e5f-8a61-7b8c9d0e1f2a",
  "message_type": "ai_codegen.generation_completed.v1",
  "occurred_at": "2026-10-24T09:45:00Z",
  "correlation_id": "0192f4a9-0000-7aaa-8bbb-cccccccccccc",
  "project_id": "5f0c2a8e-7c1b-4d2e-9a3f-1b2c3d4e5f60",
  "generation_request_id": "0192f4a9-0000-7aaa-8bbb-cccccccccccc",
  "generation_run_id": "0192f4b2-4d5e-7f60-9b72-8c9d0e1f2a3b",
  "outcome": "succeeded"
}
